{
  "archetype": "mixed_standard_hplc",
  "source_pdf": "mixed_standard_hplc_page.pdf",
  "pages": 1,
  "expected_sections": [
    {"page": 1, "section_type": "standard_lab_table", "row_count": 8},
    {"page": 1, "section_type": "hplc_diabetes_block", "row_count": 3}
  ],
  "expected_values": [
    {
      "test_name": "Glucose",
      "value": 6.8,
      "unit": "mmol/L",
      "reference_range_low": 3.9,
      "reference_range_high": 6.4,
      "flag": "H",
      "section_type": "standard_lab_table",
      "loinc_code": "2345-7"
    },
    {
      "test_name": "Creatinine",
      "value": 95,
      "unit": "umol/L",
      "reference_range_low": 62,
      "reference_range_high": 106,
      "flag": null,
      "section_type": "standard_lab_table",
      "loinc_code": "2160-0"
    },
    {
      "test_name": "Cholesterol",
      "value": 5.4,
      "unit": "mmol/L",
      "reference_range_low": null,
      "reference_range_high": 5.2,
      "flag": "H",
      "section_type": "standard_lab_table",
      "loinc_code": "2093-3"
    },
    {
      "test_name": "Triglycerides",
      "value": 2.1,
      "unit": "mmol/L",
      "reference_range_low": null,
      "reference_range_high": 1.7,
      "flag": "H",
      "section_type": "standard_lab_table",
      "loinc_code": "2571-8"
    },
    {
      "test_name": "HbA1c (NGSP)",
      "value": 6.2,
      "unit": "%",
      "reference_range_low": null,
      "reference_range_high": null,
      "flag": null,
      "section_type": "hplc_diabetes_block",
      "loinc_code": "4548-4"
    },
    {
      "test_name": "HbA1c (IFCC)",
      "value": 44,
      "unit": "mmol/mol",
      "reference_range_low": null,
      "reference_range_high": null,
      "flag": null,
      "section_type": "hplc_diabetes_block",
      "loinc_code": "59261-8"
    },
    {
      "test_name": "eAG",
      "value": 131,
      "unit": "mg/dL",
      "reference_range_low": null,
      "reference_range_high": null,
      "flag": null,
      "section_type": "hplc_diabetes_block",
      "loinc_code": "53553-4"
    }
  ],
  "expected_screening": [],
  "expected_hplc": [
    {
      "ngsp_value": 6.2,
      "ifcc_value": 44,
      "eag_value": 131,
      "diabetes_category": "prediabetes"
    }
  ]
}
